{
  "v": 1,
  "id": "evt_test_001",
  "type": "gesture.detected",
  "tenant_id": "ten_example",
  "session_id": "sess_test",
  "device_id": "dev_test",
  "gateway_id": "gw_test",
  "seq": 57,
  "sent_at": "2026-10-11T20:00:00Z",
  "expires_at": "2026-10-11T20:00:00.350Z",
  "payload": {
    "gesture": "wrist_right",
    "confidence": 0.96,
    "model_version": "demo-001",
    "quality_flags": []
  }
}
